{
  "$schema": "https://json-schema.org/draft/2020-12/schema",
  "title": "TrustedAnalysisContextV2",
  "description": "The platform-owned envelope for one analysis request. Source content travels separately; this is the metadata every output is checked against. context_sha256 is the SHA-256 of the canonical JSON of the envelope without that field.",
  "type": "object",
  "additionalProperties": false,
  "properties": {
    "schema_version": {"const": "2"},
    "context_sha256": {"$ref": "common-v2.schema.json#/$defs/sha256"},
    "listing_id": {"$ref": "common-v2.schema.json#/$defs/listing_id"},
    "symbol": {"$ref": "common-v2.schema.json#/$defs/identifier"},
    "as_of_timestamp": {"$ref": "common-v2.schema.json#/$defs/timestamp"},
    "replay_mode": {"$ref": "common-v2.schema.json#/$defs/replay_mode"},
    "horizon": {"$ref": "common-v2.schema.json#/$defs/horizon"},
    "sources": {
      "type": "array",
      "items": {
        "type": "object",
        "additionalProperties": false,
        "properties": {
          "evidence_id": {"$ref": "common-v2.schema.json#/$defs/identifier"},
          "kind": {"$ref": "common-v2.schema.json#/$defs/source_kind"},
          "event_at": {"$ref": "common-v2.schema.json#/$defs/timestamp"},
          "available_at": {"$ref": "common-v2.schema.json#/$defs/timestamp"},
          "ingested_at": {"$ref": "common-v2.schema.json#/$defs/timestamp"},
          "revision": {"$ref": "common-v2.schema.json#/$defs/identifier"},
          "content_sha256": {"$ref": "common-v2.schema.json#/$defs/sha256"},
          "metric_ids": {"$ref": "common-v2.schema.json#/$defs/identifiers"}
        },
        "required": ["evidence_id", "kind", "event_at", "available_at", "ingested_at", "revision", "content_sha256", "metric_ids"]
      }
    },
    "unavailable": {"$ref": "common-v2.schema.json#/$defs/unavailable"}
  },
  "required": ["schema_version", "context_sha256", "listing_id", "symbol", "as_of_timestamp", "replay_mode", "horizon", "sources", "unavailable"]
}
